ES,id-type-not-null,Debe indicar el tipo de identificación, ,WARNING,-1
ES,id-number-not-null,Debe indicar el número de identificación, ,WARNING,-1
ES,asset-id-not-null,Debe indicar el identificador del activo, ,WARNING,-1
ES,material-type-not-null,Debe indicar el tipo de material, ,WARNING,-1
ES,no-message,No existe un mensaje para su localidad, ,WARNING,-1
EN,no-message,There is no message for your location, ,WARNING,-1
ES,LOGIN001,Inicio de sesión exitoso, ,SUCCESS,-1
ES,LOGIN002,La clave de acceso es incorrecta, ,WARNING,-1
ES,LOGIN003,Debe suministrar nombre de usuario y contraseña, ,WARNING,-1
ES,LOGIN004,Usuario deshabilitado, ,INFORMATION,-1
ES,LOGIN005,Usuario no registrado en el sistema, ,WARNING,-1
ES,type-not-null,Debe indicar la categoria, ,WARNING,-1
ES,sub-type-not-null,Debe indicar el sub tipo, ,WARNING,-1
ES,external-provider-not-null,Debe indicar el proveedor, ,WARNING,-1
ES,name-not-null,Debe indicar el nombre, ,WARNING,-1
ES,mobility-not-null,Debe indicar la movilidad, ,WARNING,-1
ES,base-role-not-null,Debe indicar el rol, ,WARNING,-1
ES,obu-not-null,Debe indicar la organización, ,WARNING,-1
ES,state-not-null,Debe indicar el estado, ,WARNING,-1
ES,gender-not-null,Debe indicar el genero, ,WARNING,-1
ES,bpi-not-null,Debe indicar la institución, ,WARNING,-1
ES,institution-not-null,Debe indicar la institución, ,WARNING,-1
ES,username-not-null,Debe indicar el usuario, ,WARNING,-1
ES,password-not-null,Debe indicar la clave, ,WARNING,-1
ES,code-not-null,Debe indicar el código, ,WARNING,-1
ES,serial-not-null,Debe indicar el serial, ,WARNING,-1
ES,maintenance-provider-not-null,Debe indicar el proveedor de mantenimiento, ,WARNING,-1
ES,record-not-selected,Debe seleccionar un registro, ,INFORMATION,-1
ES,frecuency-not-null,Debe indicar la frecuencia, ,WARNING,-1
ES,time-period-not-null,Debe indicar el periodo de tiempo, ,WARNING,-1
ES,eia-save-success,El equipo ha sido guardado exitosamente, ,SUCCESS,-1
ES,eiaDamageReport-save-success,El Reporte de Equipo Dañado ha sido guardado exitosamente, ,SUCCESS,-1
ES,maintenance-plan-save-success,El plan de mantenimiento ha sido guardado exitosamente, ,SUCCESS,-1
ES,eiatype-save-success,El Tipo de Equipo ha sido guardado exitosamente, ,SUCCESS,-1
ES,eiatype-delete-success,El tipo de equipo ha sido eliminado exitosamente, ,SUCCESS,-1
ES,eiatypes-delete-success,Los tipos de equipo ha sido eliminado exitosamente, ,SUCCESS,-1
ES,material-save-success,El material ha sido guardado exitosamente, ,SUCCESS,-1
ES,user-save-success,El usuario ha sido guardado exitosamente, ,SUCCESS,-1
ES,mplan-save-success,El plan de mantenimiento ha sido guardado exitosamente, ,SUCCESS,-1
ES,mprot-save-success,El protocolo de mantenimiento ha sido guardado exitosamente, ,SUCCESS,-1
ES,mact-save-success,La actividad de mantenimiento ha sido guardada exitosamente, ,SUCCESS,-1
ES,eiatype-delete-fail,Falló la eliminación del EiaType, ,FAILURE,-1
ES,eiatype-save-fail,El tipo de equipo no ha sido guardado, ,FAILURE,-1
ES,eiatype-update-fail,No se pudo actualizar el Tipo de Equipo, ,FAILURE,-1
ES,eiatype-find-fail,Hubo un fallo en la búsqueda de Tipos de Equipo, ,FAILURE,-1
ES,eiatype-findByMaintenancePlan-fail,Hubo un fallo en la búsqueda del Tipo de Equipo por Plan de Mantenimeinto, ,FAILURE,-1
ES,eiatype-getAll-fail,Hubo un fallo en la búsqueda de todos los Tipos de Equipo, ,FAILURE,-1
ES,uilog-getall-fail,Fallo al buscar todos los equipos, ,FAILURE,-1
EN,eiatype-delete-fail,Failed to delete Equipment type, ,FAILURE,-1
EN,eiatype-update-fail,Failed to update Equipment type, ,FAILURE,-1
EN,eiatype-find-fail,Failed to find Equipment Type, ,FAILURE,-1
EN,eiatype-findByMaintenancePlan-fail,Failed to find Equipment type by Maintenance Plan, ,FAILURE,-1
EN,eiatype-save-fail,Failed to save Equipment type, ,FAILURE,-1
EN,eiatype-getAll-fail,Failed to get all Equipment types, ,FAILURE,-1
ES,error-eia-adquisition-dates-order,Las fechas de adquisición deben estar en orden cronológico, ,WARNING,-1
ES,error-eia-warranty-dates-order,Las fechas de garantia deben ser mayores que la fecha de compra, ,WARNING,-1
ES,function-getAll-fail,Hubo un fallo en la búsqueda de todas las Funciones, ,FAILURE,-1
EN,function-getAll-fail,Failed to get all Functions, ,FAILURE,-1
ES,instanceLogon-delete-fail,Hubo un fallo en la eliminación del InstanceLogon, ,FAILURE,-1
ES,instanceLogon-findByInstanceLogon-fail,Hubo un fallo en la búsqueda de InstanceLogon por instanceLogon, ,FAILURE,-1
ES,instanceLogon-find-fail,Hubo un fallo en la búsqueda de InstanceLogon, ,FAILURE,-1
ES,instanceLogon-getAll-fail,Hubo un fallo en la búsqueda de todos los InstanceLogon, ,FAILURE,-1
ES,instanceLogon-save-fail,Guardado fallido de InstanceLogon, ,FAILURE,-1
ES,instanceLogon-update-fail,Actualización fallida de InstanceLogon, ,FAILURE,-1
EN,instanceLogon-delete-fail,Failed to delete InstanceLogon, ,FAILURE,-1
EN,instanceLogon-findByInstanceLogon-fail,Failed to find InstanceLogon by instanceLogon, ,FAILURE,-1
EN,instanceLogon-find-fail,Failed to find InstanceLogon, ,FAILURE,-1
EN,instanceLogon-getAll-fail,Failed to get all instanceLogon, ,FAILURE,-1
EN,instanceLogon-save-fail,Failed to save InstanceLogon, ,FAILURE,-1
EN,instanceLogon-update-fail,Failed to update InstanceLogon, ,FAILURE,-1
ES,role-delete-fail,Fallo la eliminación del Rol, ,FAILURE,-1
ES,role-findByRoleBase-fail,Búsqueda fallida de Rol por rol, ,FAILURE,-1
ES,role-find-fail,Búsqueda fallida de Rol, ,FAILURE,-1
ES,role-getAll-fail,Búsqueda fallida de todos los Rol, ,FAILURE,-1
ES,role-save-fail,Guardado fallido de Rol, ,FAILURE,-1
ES,role-update-fail,Actualización fallida de Rol, ,FAILURE,-1
EN,role-delete-fail,Failed to delete Role, ,FAILURE,-1
EN,role-findByRoleBase-fail,Failed to find Role by role, ,FAILURE,-1
EN,role-find-fail,Failed to find Role, ,FAILURE,-1
EN,role-getAll-fail,Failed to get all Role, ,FAILURE,-1
EN,role-save-fail,Failed to save Role, ,FAILURE,-1
EN,role-update-fail,Failed to update Role, ,FAILURE,-1
ES,ssoUser-delete-fail,Fallo la eliminación del SSOUser, ,FAILURE,-1
ES,ssoUser-delete-success,Usuario eliminado exitosamente, ,SUCCESS,-1
ES,ssoUser-findBySsoUser-fail,Búsqueda fallida de SSOUser por ssoUser, ,FAILURE,-1
ES,ssoUser-find-fail,Búsqueda fallida de SSOUser, ,FAILURE,-1
ES,ssoUser-getAll-fail,Búsqueda fallida de todos los SSOUser, ,FAILURE,-1
ES,ssoUser-save-fail,Guardado fallido de SSOUser, ,FAILURE,-1
ES,ssoUser-update-fail,Actualización fallida de SSOUser, ,FAILURE,-1
ES,ssoUser-findByUserName-fail,Búsqueda fallida de SSOUser por userName, ,FAILURE,-1
EN,ssoUser-delete-fail,Failed to delete SSOUSer, ,FAILURE,-1
EN,ssoUser-findBySsoUser-fail,Failed to find SSOUser by ssoUser, ,FAILURE,-1
EN,ssoUser-find-fail,Failed to find SSOUser, ,FAILURE,-1
EN,ssoUser-getAll-fail,Failed to get all SSOUser, ,FAILURE,-1
EN,ssoUser-save-fail,Failed to save SSOUser, ,FAILURE,-1
EN,ssoUser-update-fail,Failed to update SSOUser, ,FAILURE,-1
EN,ssoUser-findByUserName-fail,Failed to find SSOUser by userName, ,FAILURE,-1
ES,bpuFunction-save-fail,Guardado fallido del BpuFunction, ,FAILURE,-1
ES,bpuFunction-delete-fail,Fallo la eliminación del BpuFunction, ,FAILURE,-1
ES,bpuFunction-getFunctionsByBpu-fail,Búsqueda fallida de BpuFunction por bpu, ,FAILURE,-1
EN,bpuFunction-save-fail,Failed to save BpuFunction, ,FAILURE,-1
EN,bpuFunction-delete-fail,Failed to delete BpuFunction, ,FAILURE,-1
EN,bpuFunction-getFunctionsByBpu-fail,Failed to get BpuFunction by bpu, ,FAILURE,-1
ES,workingArea-delete-fail,Fallo la eliminación del WorkingArea, ,FAILURE,-1
ES,workingArea-findByWorkingArea-fail,Búsqueda fallida de WorkingArea por workingArea, ,FAILURE,-1
ES,workingArea-find-fail,Búsqueda fallida de WorkingArea, ,FAILURE,-1
ES,workingArea-getAll-fail,Búsqueda fallida de todos los WorkingArea, ,FAILURE,-1
ES,workingArea-save-fail,Guardado fallido de WorkingArea, ,FAILURE,-1
ES,workingArea-update-fail,Actualización fallida de WorkingArea, ,FAILURE,-1
EN,workingArea-delete-fail,Failed to delete WorkingArea, ,FAILURE,-1
EN,workingArea-findByWorkingArea-fail,Failed to find WorkingArea by workingArea, ,FAILURE,-1
EN,workingArea-find-fail,Failed to find WorkingArea, ,FAILURE,-1
EN,workingArea-getAll-fail,Failed to get all WorkingArea, ,FAILURE,-1
EN,workingArea-save-fail,Failed to save WorkingArea, ,FAILURE,-1
EN,workingArea-update-fail,Failed to update WorkingArea, ,FAILURE,-1
ES,bpu-delete-fail,Fallo la eliminación del Bpu, ,FAILURE,-1
ES,bpu-findByBpu-fail,Búsqueda fallida de Bpu por bpu, ,FAILURE,-1
ES,bpu-find-fail,Búsqueda fallida de Bpu, ,FAILURE,-1
ES,bpu-getAll-fail,Búsqueda fallida de todos los Bpu, ,FAILURE,-1
ES,bpu-save-fail,Guardado fallido de Bpu, ,FAILURE,-1
ES,bpu-update-fail,Actualización fallida de Bpu, ,FAILURE,-1
EN,bpu-delete-fail,Failed to delete Bpu, ,FAILURE,-1
EN,bpu-findByBpu-fail,Failed to find Bpu by bpu, ,FAILURE,-1
EN,bpu-find-fail,Failed to find Bpu, ,FAILURE,-1
EN,bpu-getAll-fail,Failed to get all Bpu, ,FAILURE,-1
EN,bpu-save-fail,Failed to save Bpu, ,FAILURE,-1
EN,bpu-update-fail,Failed to update Bpu, ,FAILURE,-1
ES,facility-delete-fail,Fallo la eliminación del Facility, ,FAILURE,-1
ES,facility-findByFacility-fail,Búsqueda fallida de Facility por facility, ,FAILURE,-1
ES,facility-find-fail,Búsqueda fallida de Facility, ,FAILURE,-1
ES,facility-getAll-fail,Búsqueda fallida de todos los Facility, ,FAILURE,-1
ES,facility-save-fail,Guardado fallido de Facility, ,FAILURE,-1
ES,facility-update-fail,Actualización fallida de Facility, ,FAILURE,-1
EN,facility-delete-fail,Failed to delete Facility, ,FAILURE,-1
EN,facility-findByFacility-fail,Failed to find Facility by facility, ,FAILURE,-1
EN,facility-find-fail,Failed to find Facility, ,FAILURE,-1
EN,facility-getAll-fail,Failed to get all Facility, ,FAILURE,-1
EN,facility-save-fail,Failed to save Facility, ,FAILURE,-1
EN,facility-update-fail,Failed to update Facility, ,FAILURE,-1
ES,obu-delete-fail,Fallo la eliminación del Obu, ,FAILURE,-1
ES,obu-findByObu-fail,Búsqueda fallida de Obu por obu, ,FAILURE,-1
ES,obu-find-fail,Búsqueda fallida de Obu, ,FAILURE,-1
ES,obu-getAll-fail,Búsqueda fallida de todos los Obu, ,FAILURE,-1
ES,obu-save-fail,Guardado fallido de Obu, ,FAILURE,-1
ES,obu-update-fail,Actualización fallida de Obu, ,FAILURE,-1
EN,obu-delete-fail,Failed to delete Obu, ,FAILURE,-1
EN,obu-findByObu-fail,Failed to find Obu by obu, ,FAILURE,-1
EN,obu-find-fail,Failed to find Obu, ,FAILURE,-1
EN,obu-getAll-fail,Failed to get all Obu, ,FAILURE,-1
EN,obu-save-fail,Failed to save Obu, ,FAILURE,-1
EN,obu-update-fail,Failed to update Obu, ,FAILURE,-1
ES,externalProvider-delete-fail,Fallo la eliminación del ExternalProvider, ,FAILURE,-1
ES,externalProvider-findByExternalProvider-fail,Búsqueda fallida de ExternalProvider por externalProvider, ,FAILURE,-1
ES,externalProvider-find-fail,Búsqueda fallida de ExternalProvider, ,FAILURE,-1
ES,externalProvider-getAll-fail,Búsqueda fallida de todos los ExternalProvider, ,FAILURE,-1
ES,externalProvider-save-fail,Guardado fallido de ExternalProvider, ,FAILURE,-1
ES,externalProvider-update-fail,Actualización fallida de ExternalProvider, ,FAILURE,-1
EN,externalProvider-delete-fail,Failed to delete ExternalProvider, ,FAILURE,-1
EN,externalProvider-findByExternalProvider-fail,Failed to find ExternalProvider by externalProvider, ,FAILURE,-1
EN,externalProvider-find-fail,Failed to find ExternalProvider, ,FAILURE,-1
EN,externalProvider-getAll-fail,Failed to get all ExternalProvider, ,FAILURE,-1
EN,externalProvider-save-fail,Failed to save ExternalProvider, ,FAILURE,-1
EN,externalProvider-update-fail,Failed to update ExternalProvider, ,FAILURE,-1
ES,materialCategory-delete-fail,Fallo la eliminación del MaterialCategory, ,FAILURE,-1
ES,materialCategory-findByMaterialCategory-fail,Búsqueda fallida de MaterialCategory por materialCategory, ,FAILURE,-1
ES,materialCategory-find-fail,Búsqueda fallida de MaterialCategory, ,FAILURE,-1
ES,materialCategory-getAll-fail,Búsqueda fallida de todos los MaterialCategory, ,FAILURE,-1
ES,materialCategory-save-fail,Guardado fallido de MaterialCategory, ,FAILURE,-1
ES,materialCategory-update-fail,Actualización fallida de MaterialCategory, ,FAILURE,-1
EN,materialCategory-delete-fail,Failed to delete MaterialCategory, ,FAILURE,-1
EN,materialCategory-findByMaterialCategory-fail,Failed to find MaterialCategory by materialCategory, ,FAILURE,-1
EN,materialCategory-find-fail,Failed to find MaterialCategory, ,FAILURE,-1
EN,materialCategory-getAll-fail,Failed to get all MaterialCategory, ,FAILURE,-1
EN,materialCategory-save-fail,Failed to save MaterialCategory, ,FAILURE,-1
EN,materialCategory-update-fail,Failed to update MaterialCategory, ,FAILURE,-1
ES,material-delete-fail,Fallo la eliminación del Material, ,FAILURE,-1
ES,material-findByMaterial-fail,Búsqueda fallida de Material por material, ,FAILURE,-1
ES,material-find-fail,Búsqueda fallida de Material, ,FAILURE,-1
ES,material-findByType-fail,Búsqueda fallida de Material por Tipo, ,FAILURE,-1
ES,material-findByBrand-fail,Búsqueda fallida de Material por Brand, ,FAILURE,-1
ES,material-getAll-fail,Búsqueda fallida de todos los Material, ,FAILURE,-1
ES,material-save-fail,Guardado fallido de Material, ,FAILURE,-1
ES,material-update-fail,Actualización fallida de Material, ,FAILURE,-1
EN,material-delete-fail,Failed to delete Material, ,FAILURE,-1
EN,material-findByMaterial-fail,Failed to find Material by material, ,FAILURE,-1
EN,material-find-fail,Failed to find Material, ,FAILURE,-1
EN,material-findByType-fail,Failed to find Material by Type, ,FAILURE,-1
EN,material-findByBrand-fail,Falied to find Material by Brand, ,FAILURE,-1
EN,material-getAll-fail,Failed to get all Material, ,FAILURE,-1
EN,material-save-fail,Failed to save Material, ,FAILURE,-1
EN,material-update-fail,Failed to update Material, ,FAILURE,-1
ES,brand-delete-fail,Fallo la eliminación del Brand, ,FAILURE,-1
ES,brand-findByBrand-fail,Búsqueda fallida de Brand por brand, ,FAILURE,-1
ES,brand-find-fail,Búsqueda fallida de Brand, ,FAILURE,-1
ES,brand-findByManufacturer-fail,Búsqueda fallida de Brand por Manufacturer, ,FAILURE,-1
ES,brand-getAll-fail,Búsqueda fallida de todos los Brand, ,FAILURE,-1
ES,brand-save-fail,Guardado fallido de Brand, ,FAILURE,-1
ES,brand-update-fail,Actualización fallida de Brand, ,FAILURE,-1
EN,brand-delete-fail,Failed to delete Brand, ,FAILURE,-1
EN,brand-findByBrand-fail,Failed to find Brand by brand, ,FAILURE,-1
EN,brand-find-fail,Failed to find Brand, ,FAILURE,-1
EN,brand-findByManufacturer-fail,Failed to find Brand by Manufacturer, ,FAILURE,-1
EN,brand-getAll-fail,Failed to get all Brand, ,FAILURE,-1
EN,brand-save-fail,Failed to save Brand, ,FAILURE,-1
EN,brand-update-fail,Failed to update Brand, ,FAILURE,-1
ES,buildingLocation-delete-fail,Fallo la eliminación del BuildingLocation, ,FAILURE,-1
ES,buildingLocation-findByBuildingLocation-fail,Búsqueda fallida de BuildingLocation por buildingLocation, ,FAILURE,-1
ES,buildingLocation-find-fail,Búsqueda fallida de BuildingLocation, ,FAILURE,-1
ES,buildingLocation-getAll-fail,Búsqueda fallida de todos los BuildingLocation, ,FAILURE,-1
ES,buildingLocation-save-fail,Guardado fallido de BuildingLocation, ,FAILURE,-1
ES,buildingLocation-update-fail,Actualización fallida de BuildingLocation, ,FAILURE,-1
EN,buildingLocation-delete-fail,Failed to delete BuildingLocation, ,FAILURE,-1
EN,buildingLocation-findByBuildingLocation-fail,Failed to find BuildingLocation by buildingLocation, ,FAILURE,-1
EN,buildingLocation-find-fail,Failed to find BuildingLocation, ,FAILURE,-1
EN,buildingLocation-getAll-fail,Failed to get all BuildingLocation, ,FAILURE,-1
EN,buildingLocation-save-fail,Failed to save BuildingLocation, ,FAILURE,-1
EN,buildingLocation-update-fail,Failed to update BuildingLocation, ,FAILURE,-1
ES,eiaComponent-delete-fail,Fallo la eliminación del EiaComponent, ,FAILURE,-1
ES,eiaComponent-findByParentEia-fail,Búsqueda fallida de EiaComponent por parentEia, ,FAILURE,-1
ES,eiaComponent-find-fail,Búsqueda fallida de EiaComponent, ,FAILURE,-1
ES,eiaComponent-getAll-fail,Búsqueda fallida de todos los EiaComponent, ,FAILURE,-1
ES,eiaComponent-save-fail,Guardado fallido de EiaComponent, ,FAILURE,-1
ES,eiaComponent-update-fail,Actualización fallida de EiaComponent, ,FAILURE,-1
EN,eiaComponent-delete-fail,Failed to delete EiaComponent, ,FAILURE,-1
EN,eiaComponent-findByParentEia-fail,Failed to find EiaComponent by parentEia, ,FAILURE,-1
EN,eiaComponent-find-fail,Failed to find EiaComponent, ,FAILURE,-1
EN,eiaComponent-getAll-fail,Failed to get all EiaComponent, ,FAILURE,-1
EN,eiaComponent-save-fail,Failed to save EiaComponent, ,FAILURE,-1
EN,eiaComponent-update-fail,Failed to update EiaComponent, ,FAILURE,-1
ES,eiaPicture-delete-fail,Fallo la eliminación del EiaPicture, ,FAILURE,-1
ES,eiaPicture-findByEia-fail,Búsqueda fallida de EiaPicture por eia, ,FAILURE,-1
ES,eiaPicture-find-fail,Búsqueda fallida de EiaPicture, ,FAILURE,-1
ES,eiaPicture-getAll-fail,Búsqueda fallida de todos los EiaPicture, ,FAILURE,-1
ES,eiaPicture-save-fail,Guardado fallido de EiaPicture, ,FAILURE,-1
ES,eiaPicture-update-fail,Actualización fallida de EiaPicture, ,FAILURE,-1
EN,eiaPicture-delete-fail,Failed to delete EiaPicture, ,FAILURE,-1
EN,eiaPicture-findByEia-fail,Failed to find EiaPicture by eia, ,FAILURE,-1
EN,eiaPicture-find-fail,Failed to find EiaPicture, ,FAILURE,-1
EN,eiaPicture-getAll-fail,Failed to get all EiaPicture, ,FAILURE,-1
EN,eiaPicture-save-fail,Failed to save EiaPicture, ,FAILURE,-1
EN,eiaPicture-update-fail,Failed to update EiaPicture, ,FAILURE,-1
ES,eia-delete-fail,Fallo la eliminación del Eia, ,FAILURE,-1
ES,eia-delete-success,El equipo a sido eliminado exitosamente, ,SUCCESS,-1
ES,eia-findByEia-fail,Búsqueda fallida de Eia por eia, ,FAILURE,-1
ES,eia-findByEiaType-fail,Búsqueda fallida de Eia por eiaType, ,FAILURE,-1
ES,eia-find-fail,Búsqueda fallida de Eia, ,FAILURE,-1
ES,eia-getAll-fail,Búsqueda fallida de todos los Eia, ,FAILURE,-1
ES,eia-save-fail,Guardado fallido de Eia, ,FAILURE,-1
ES,eia-update-fail,Actualización fallida de Eia, ,FAILURE,-1
EN,eia-delete-fail,Failed to delete Eia, ,FAILURE,-1
EN,eia-findByEia-fail,Failed to find Eia by eia, ,FAILURE,-1
EN,eia-findByEiaType-fail,Failed to find Eia by eiaType, ,FAILURE,-1
EN,eia-find-fail,Failed to find Eia, ,FAILURE,-1
EN,eia-getAll-fail,Failed to get all Eia, ,FAILURE,-1
EN,eia-save-fail,Failed to save Eia, ,FAILURE,-1
EN,eia-update-fail,Failed to update Eia, ,FAILURE,-1
ES,eiaTypeComponent-delete-fail,Fallo la eliminación del EiaTypeComponent, ,FAILURE,-1
ES,eiaTypeComponent-findByParentEiaType-fail,Búsqueda fallida de EiaTypeComponent por parentEiaType, ,FAILURE,-1
ES,eiaTypeComponent-find-fail,Búsqueda fallida de EiaTypeComponent, ,FAILURE,-1
ES,eiaTypeComponent-getAll-fail,Búsqueda fallida de todos los EiaTypeComponent, ,FAILURE,-1
ES,eiaTypeComponent-save-fail,Guardado fallido de EiaTypeComponent, ,FAILURE,-1
ES,eiaTypeComponent-update-fail,Actualización fallida de EiaTypeComponent, ,FAILURE,-1
EN,eiaTypeComponent-delete-fail,Failed to delete EiaTypeComponent, ,FAILURE,-1
EN,eiaTypeComponent-findByParentEiaType-fail,Failed to find EiaTypeComponent by parentEiaType, ,FAILURE,-1
EN,eiaTypeComponent-find-fail,Failed to find EiaTypeComponent, ,FAILURE,-1
EN,eiaTypeComponent-getAll-fail,Failed to get all EiaTypeComponent, ,FAILURE,-1
EN,eiaTypeComponent-save-fail,Failed to save EiaTypeComponent, ,FAILURE,-1
EN,eiaTypeComponent-update-fail,Failed to update EiaTypeComponent, ,FAILURE,-1
ES,eiaTypeMaintenancePlan-delete-fail,Fallo la eliminación del EiaTypeMaintenancePlan, ,FAILURE,-1
ES,requiredResources-delete-fail,Fallo la eliminación del RequiredResources, ,FAILURE,-1
ES,eiaTypeMaintenancePlan-findByEiaType-fail,Búsqueda fallida de EiaTypeMaintenancePlan por eiaType, ,FAILURE,-1
ES,requiredResources-findByServiceAndResource-fail,Búsqueda fallida de RequiredResources por serviceAndResource, ,FAILURE,-1
ES,requiredResources-findByActivity-fail,Búsqueda fallida de RequiredResources por activity, ,FAILURE,-1
ES,requiredResources-update-fail,Actualización fallida de RequiredResources, ,FAILURE,-1
ES,eiaTypeMaintenancePlan-findByMaintenancePlan-fail,Búsqueda fallida de EiaTypeMaintenancePlan po maintenancePlan, ,FAILURE,-1
ES,eiaTypeMaintenancePlan-save-fail,Guardado fallido de EiaTypeMaintenancePlan, ,FAILURE,-1
ES,requiredResources-save-fail,Guardado fallido de RequiredResources, ,FAILURE,-1
EN,eiaTypeMaintenancePlan-delete-fail,Failed to delete EiaTypeMaintenancePlan, ,FAILURE,-1
EN,requiredResources-delete-fail,Failed to delete RequiredResources, ,FAILURE,-1
EN,eiaTypeMaintenancePlan-findByEiaType-fail,Failed to find EiaTypeMaintenancePlan by eiaType, ,FAILURE,-1
EN,requiredResources-findByServiceAndResource-fail,Failed to find RequiredResources by serviceAndResource, ,FAILURE,-1
EN,requiredResources-findByActivity-fail,Failed to find RequiredResources by activity, ,FAILURE,-1
EN,eiaTypeMaintenancePlan-findByMaintenancePlan-fail,Failed to find EiaTypeMaintenancePlan by maintenancePlan, ,FAILURE,-1
EN,eiaTypeMaintenancePlan-save-fail,Failed to save EiaTypeMaintenancePlan, ,FAILURE,-1
EN,requiredResources-save-fail,Failed to save RequiredResources, ,FAILURE,-1
ES,eiaTypeMaterial-delete-fail,Fallo la eliminación del EiaTypeMaterial, ,FAILURE,-1
ES,eiaTypeMaterial-findByEiaType-fail,Búsqueda fallida de EiaTypeMaterial por eiaType, ,FAILURE,-1
ES,eiaTypeMaterial-save-fail,Guardado fallido de EiaTypeMaterial, ,FAILURE,-1
EN,eiaTypeMaterial-delete-fail,Failed to delete EiaTypeMaterial, ,FAILURE,-1
EN,eiaTypeMaterial-findByEiaType-fail,Failed to find EiaTypeMaterial by eiaType, ,FAILURE,-1
EN,eiaTypeMaterial-save-fail,Failed to save EiaTypeMaterial, ,FAILURE,-1
ES,eiaTypeMaterial-update-fail,Actualización fallida de EiaTypeMaterial, ,FAILURE,-1
EN,eiaTypeMaterial-update-fail,Actualización fallida del EiaType y el Material, ,FAILURE,-1
ES,eiaTypePicture-delete-fail,Fallo la eliminación del EiaTypePicture, ,FAILURE,-1
ES,eiaTypePicture-findByEiaType-fail,Búsqueda fallida de EiaTypePicture por eiaType, ,FAILURE,-1
ES,eiaTypePicture-find-fail,Búsqueda fallida de EiaTypePicture, ,FAILURE,-1
ES,eiaTypePicture-save-fail,Guardado fallido de EiaTypePicture, ,FAILURE,-1
ES,eiaTypePicture-update-fail,Actualización fallida de EiaTypePicture, ,FAILURE,-1
EN,eiaTypePicture-delete-fail,Failed to delete EiaTypePicture, ,FAILURE,-1
EN,eiaTypePicture-findByEiaType-fail,Failed to find EiaTypePicture by eiaType, ,FAILURE,-1
EN,eiaTypePicture-find-fail,Failed to find EiaTypePicture, ,FAILURE,-1
EN,eiaTypePicture-save-fail,Failed to save EiaTypePicture, ,FAILURE,-1
EN,eiaTypePicture-update-fail,Failed to update EiaTypePicture, ,FAILURE,-1
ES,eiaTypeUtility-delete-fail,Fallo la eliminación del EiaTypeUtility, ,FAILURE,-1
ES,eiaTypeUtility-findByEiaType-fail,Búsqueda fallida de EiaTypeUtility por eiaType, ,FAILURE,-1
ES,eiaTypeUtility-save-fail,Guardado fallido de EiaTypeUtility, ,FAILURE,-1
EN,eiaTypeUtility-delete-fail,Failed to delete EiaTypeUtility, ,FAILURE,-1
EN,eiaTypeUtility-findByEiaType-fail,Failed to find EiaTypeUtility by eiaType, ,FAILURE,-1
EN,eiaTypeUtility-save-fail,Failed to save EiaTypeUtility, ,FAILURE,-1
EN,eiaTypeUtility-update-fail,Failed to save EiaTypeUtility, ,FAILURE,-1
ES,eiaTypeUtility-update-fail,Fallo la actualización del EiaType y el Servicio Utilitario, ,FAILURE,-1
ES,maintenanceActivityMaintenanceProtocol-delete-fail,Fallo la eliminación del MaintenanceActivityMaintenanceProtocol, ,FAILURE,-1
ES,maintenanceActivityMaintenanceProtocol-findByMaintenanceActivity-fail,Búsqueda fallida de MaintenanceActivityMaintenanceProtocol por actividad de mantenimiento, ,FAILURE,-1
ES,maintenanceActivityMaintenanceProtocol-findByMaintenanceProtocol-fail,Búsqueda fallida de MaintenanceActivityMaintenanceProtocol por protocolo de mantenimiento, ,FAILURE,-1
ES,maintenanceActivityMaintenanceProtocol-save-fail,Guardado fallido de MaintenanceActivityMaintenanceProtocol, ,FAILURE,-1
EN,maintenanceActivityMaintenanceProtocol-delete-fail,Failed to delete MaintenanceActivityMaintenanceProtocol, ,FAILURE,-1
EN,maintenanceActivityMaintenanceProtocol-findByMaintenanceActivity-fail,Failed to find MaintenanceActivityMaintenanceProtocol by maintenance activity, ,FAILURE,-1
EN,maintenanceActivityMaintenanceProtocol-findByMaintenanceProtocol-fail,Failed to find MaintenanceActivityMaintenanceProtocol by maintenance protocol, ,FAILURE,-1
EN,maintenanceActivityMaintenanceProtocol-save-fail,Failed to save MaintenanceActivityMaintenanceProtocol, ,FAILURE,-1
ES,maintenanceActivity-delete-fail,Fallo la eliminación del MaintenanceActivity, ,FAILURE,-1
ES,maintenanceActivity-findByMaintenanceProtocol-fail,Búsqueda fallida de MaintenanceActivity por protocolo de mantenimiento, ,FAILURE,-1
ES,maintenanceActivity-findByServiceResource-fail,Búsqueda fallida de MaintenanceActivity por serviceResource, ,FAILURE,-1
ES,maintenanceActivity-find-fail,Búsqueda fallida de MaintenanceActivity, ,FAILURE,-1
ES,maintenanceActivity-findByMaintenanceActivity-fail,Búsqueda fallida de MaintenanceActivity por maintenanceActivity, ,FAILURE,-1
ES,maintenanceActivity-getAll-fail,Búsqueda fallida de todos los MaintenanceActivity, ,FAILURE,-1
ES,maintenanceActivity-save-fail,Guardado fallido de MaintenanceActivity, ,FAILURE,-1
ES,maintenanceActivity-update-fail,Actualización fallida de MaintenanceActivity, ,FAILURE,-1
EN,maintenanceActivity-delete-fail,Failed to delete MaintenanceActivity, ,FAILURE,-1
EN,maintenanceActivity-findByMaintenanceProtocol-fail,Failed to find MaintenanceActivity by maintenance protocol, ,FAILURE,-1
EN,maintenanceActivity-findByServiceResource-fail,Failed to find MaintenanceActivity by serviceResource, ,FAILURE,-1
EN,maintenanceActivity-find-fail,Failed to find MaintenanceActivity, ,FAILURE,-1
EN,maintenanceActivity-findByMaintenanceActivity-fail,Failed to find MaintenanceActivity by maintenanceActivity, ,FAILURE,-1
